Make: Honda, Model: CR-V HYBRID, Year min:2023, Odometer max: 30000, Fuel Type: Hybrid, Equipment:Touring
Make: Mercedes-Benz, Model: GLE 350; GLB 250, Year min:2022, Year max: 2023, Odometer max: 30000, Fuel Type: Gasoline, Equipment: 4MATIC
Make: Mazda, Model:cx-5;cx-9, Year min: 2024, Odometer max: 30000, Fuel Type: Gas, Equipment: Signature
Make: Lincoln, Model:Corsair;Nautilus, Year min:2024, Odometer max: 30000
Make: Audi, Model: Q5, Year min: 2023, Odometer max: 30000, Fuel Type: Gas, Equipment: Premium 45
Make: Mazda, Model:cx-90, Year min: 2024, Odometer max: 30000, Fuel Type: Gas, Equipment: Sport
Make: Lexus, Model:rx 350, Year min: 2022, Year max: 2024, Odometer max: 30000, Fuel Type: Gas